{
  "schema_version": 1,
  "policy_id": "projectkoios.code.python-test",
  "policy_version": "0.1.0",
  "status": "Draft",
  "title": "Project Koios Python test policy",
  "authority": {
    "source_format": "json",
    "projection_format": "markdown",
    "source_path": "docs/policies/code/python_test.json",
    "projection_path": "docs/policies/code/python_test.md",
    "projection_status": "generated"
  },
  "purpose": "Define Project Koios requirements for proportionate Python tests, maintained evidence, ownership, independent oracles, fixtures, and honest acceptance claims.",
  "scope": [
    "New or materially changed Python tests in Project Koios owner repositories.",
    "Test-owned fixtures, schemas, golden bytes, structured declaration records, ownership records, and parameter cases.",
    "Software verification and separately authorized numerical verification, scientific validation, or uncertainty-quantification tests."
  ],
  "exclusions": [
    "Automatic repository-wide rewrites of conforming existing tests.",
    "Scientific, numerical, uncertainty-quantification, publication, release, or human-acceptance claims inferred from routine software-verification evidence.",
    "Production behavior added solely to make test construction convenient.",
    "Weakening expectations, tolerances, or coverage merely to obtain a pass."
  ],
  "precedence": [
    "Accepted contracts, scientific specifications, and architecture decisions.",
    "The owning repository's AGENTS.md, pyproject.toml, and maintained commands.",
    "The Project Koios Python code policy.",
    "This Project Koios Python test policy.",
    "Adapted predecessor conventions recorded under source_provenance."
  ],
  "code_policy": {
    "policy_id": "projectkoios.code.python",
    "policy_version": "0.1.0",
    "source_path": "docs/policies/code/python.json",
    "requirements": [
      "Every named variable has an explicit type annotation where Python syntax permits one.",
      "Every public and private method has explicit annotations and keyword-only parameters after self or cls except where a protocol requires another signature.",
      "Every method call spells each argument name where the callable supports keyword arguments.",
      "Small helper behavior belongs to its cohesive owner; a test-only module helper is acceptable when clearer than an artificial class.",
      "The test package initializer exposes only a deliberate stable API when a public test-support API is required."
    ]
  },
  "source_provenance": {
    "source_repository": "https://github.com/eragasa/ksdft2effmass",
    "source_revision": "7bd913151f7e61ed2bdba593df920be36573b502",
    "source_license": "Apache-2.0",
    "adaptation": "Project Koios retains the predecessor's evidence-class separation, routine and claim-bearing profiles, stable evidence identifiers, module metadata, cohesive Test ownership, semantic parameter identities, independent-oracle requirements, exact acceptance, deterministic structural audit, and stop boundaries. It adapts helper placement, test-name spelling, repository paths, command names, and migration timing to Project Koios authority.",
    "inputs": [
      {
        "path": "AGENTS.md",
        "sha256": "72146e726e4251437a14e9ac0cf8c16db2750e8daa471f1a0fe03499697d3a9a",
        "byte_count": 35349,
        "use": "Testing ownership, Test-class structure, helper placement, resources, negative typing tests, evidence limitations, and stop boundaries."
      },
      {
        "path": ".pi/skills/develop-python-test-evidence/SKILL.md",
        "sha256": "110c3ef295deaa4188a9358638fcb808b9b7e618437fbdb4b87836a7035779fc",
        "byte_count": 5430,
        "use": "Evidence classes, ownership selection, naming, oracle quality, deterministic validation boundary, and stop conditions."
      },
      {
        "path": ".pi/skills/develop-python-test-evidence/references/test-evidence-conventions.md",
        "sha256": "86ec2f4c392b0c91c1338708ecdcf7fe13c4ab02db62576327ad954abcc59fc8",
        "byte_count": 11387,
        "use": "Detailed conventions for ownership, helpers, naming, parameterization, layering, exact and approximate acceptance, and evidence claims."
      },
      {
        "path": "harness/pi/evidence/python-test-evidence-profile-matrix-v1.json",
        "sha256": "085b4380cab81308b1e25672e039c838a872236533641ac415a1bec1253332d6",
        "byte_count": 1873,
        "use": "Predecessor routine and claim-bearing evidence-field profiles; adapted rather than copied as universal requirements."
      },
      {
        "path": "python/pyproject.toml",
        "sha256": "30f9fd960bb02b475ff620805f3e5d2d7325c57cf110b51a7e2e414d979b01f0",
        "byte_count": 2744,
        "use": "Pytest strictness, evidence markers, coverage, Ruff, MyPy, and Python 3.14 configuration reference."
      },
      {
        "path": "harness/pi/docs/evidence-grammar.md",
        "sha256": "1db352ccd4f8298a8286eb394907d0d319ca9a5ed95bc04de56c434f15b37c03",
        "byte_count": 8453,
        "use": "Authority flow, ownership grammar, evidence classes, validator boundaries, and maintained conformance ownership."
      },
      {
        "path": "python/src/ksdft2effmass/harness/pi/conformance/python/validation.py",
        "sha256": "40be6479238a0ee95a341eb5bc020241c084d1ac41a377dcc076250aa23836e4",
        "byte_count": 26617,
        "use": "Reusable explicit-input PythonConformanceValidator orchestration, immutable result model, deterministic diagnostics, and claim boundary."
      },
      {
        "path": "python/src/ksdft2effmass/harness/pi/conformance/python/strict.py",
        "sha256": "468e1ad59972afe22b63fa5a6f9f52e2d577931ef10dd693ac49a3cfe9f6d8f7",
        "byte_count": 26529,
        "use": "Reusable strict coding-standards adapter, Test-owner checks, helper ownership, typing checks, and resource placement."
      },
      {
        "path": "python/src/ksdft2effmass/harness/pi/local/evidence_repository_conformance.py",
        "sha256": "61dcd86e0555b18c70b388b0831a6381c6249437fdca1cb61ed7391a167525b7",
        "byte_count": 3958,
        "use": "Repository-local adapter pattern that resolves source authority and invokes the explicit-input validator without making generated inventories authoritative."
      },
      {
        "path": "python/src/ksdft2effmass/harness/cli/validate_evidence_repository_conformance.py",
        "sha256": "687b49029f1d24af5263554608e79626647ea2c2165be3e9a684db13092c4fa5",
        "byte_count": 3044,
        "use": "Thin deterministic JSON CLI and bounded INVALID_INPUT, INTERNAL_ERROR, PASS, and FAIL command outcomes."
      }
    ]
  },
  "evidence_classes": [
    {
      "evidence_class": "software_verification",
      "establishes": "The implemented public software contract behaves as specified under the tested conditions.",
      "does_not_establish": "Numerical correctness, scientific adequacy, uncertainty quantification, publication authority, release readiness, or human acceptance."
    },
    {
      "evidence_class": "numerical_verification",
      "establishes": "A numerical implementation agrees with an independently derived mathematical oracle under an explicit criterion.",
      "does_not_establish": "Physical-model adequacy, scientific validation, uncertainty quantification, or human acceptance."
    },
    {
      "evidence_class": "scientific_validation",
      "establishes": "A declared use is adequate against trusted physical, experimental, or scientific reference evidence under a separately authorized protocol.",
      "does_not_establish": "Adequacy outside the declared use or protocol, publication authority, or general human acceptance."
    },
    {
      "evidence_class": "uncertainty_quantification",
      "establishes": "Declared uncertainty sources are characterized or propagated under an explicit uncertainty model or protocol.",
      "does_not_establish": "Scientific adequacy outside that uncertainty model or automatic acceptance of a result."
    }
  ],
  "profiles": [
    {
      "profile_id": "routine",
      "when": "Maintained software-verification tests whose claims remain bounded to ordinary software behavior and do not carry a numerical, scientific-validation, or uncertainty-quantification claim.",
      "requirements": [
        "A static pytest marker links each explicitly admitted test function to one structured declaration record.",
        "The declaration owns evidence identity, requirement, acceptance, claim boundary, limitations, and provenance metadata without duplicating it in decorators or docstrings.",
        "Method, oracle, interpretation, and limitations are optional when they add useful information and the represented claim remains routine software verification.",
        "Evidence identifiers remain stable through authorized renames and migrations.",
        "Routine evidence remains software verification and cannot be relabeled as a numerical, scientific-validation, uncertainty-quantification, publication, release, or human-acceptance result."
      ]
    },
    {
      "profile_id": "claim_bearing",
      "when": "Maintained software or scientific tests that support an explicit numerical-verification, scientific-validation, uncertainty-quantification, or elevated software-contract claim.",
      "requirements": [
        "A static pytest marker links each explicitly admitted test function to one structured declaration record.",
        "The declaration owns evidence identity, requirement, method, oracle, acceptance, interpretation, claim boundary, limitations, and provenance metadata without duplicating it in decorators or docstrings.",
        "External references require immutable content identity or explicit unresolved status.",
        "Evidence identifiers remain stable through authorized renames and migrations.",